title,price,rating,reviews,availability
"ACEMAGIC 2025 LX15 Laptop, 15.6-inch FHD (1920 x 1080) Display, Intel N97 Processor, 16GB DDR4 RAM, 512GB SSD, Windows 11 Pro, Wi-Fi 5, 180° Fold, Ideal for Work & Study",,4.6 out of 5 stars,25 ratings,In Stock
"AOC 2025 AX15 Laptop Computer, 15.6-inch FHD Screen, Work Laptops with N97 Processor(Up to 3.6GHz) 16GB RAM, 512GB SSD, Windows 11 Laptop Computer, Light&Thin, Metal Shell, Webcam, Type-C, USB3.2",,4.3 out of 5 stars,5 ratings,
"HP 14 Laptop, Intel Celeron N4020, 4 GB RAM, 64 GB Storage, 14-inch Micro-edge HD Display, Windows 11 Home, Thin & Portable, 4K Graphics, One Year of Microsoft 365 (14-dq0040nr, Snowflake White)",,4.3 out of 5 stars,"3,741 ratings",Only 4 left in stock - order soon.
"HP Stream 14"" HD BrightView Laptop, Intel Celeron N4120, 16GB RAM, 288GB Storage (128GB eMMC + 160GB Docking Station Set), Intel UHD Graphics, 720p Webcam, Wi-Fi, 1 Year Office 365, Win 11 S, Silver",,4.5 out of 5 stars,"2,999 ratings",In Stock
"Apple 2025 MacBook Air 13-inch Laptop with M4 chip: Built for Apple Intelligence, 13.6-inch Liquid Retina Display, 16GB Unified Memory, 256GB SSD Storage, 12MP Center Stage Camera, Touch ID; Sky Blue",,4.8 out of 5 stars,"1,782 ratings",Not Available
"SGIN 17.3 Inch Laptop Computer, Win 11 Laptops with Celeron I3 Processor, 4GB DDR3 128GB SSD, 60800mWh Battery, FHD IPS Display, HDMI, Type-C, Numpad, 5G WiFi, BT4.2, for Business and Students",,4.3 out of 5 stars,25 ratings,Only 6 left in stock - order soon.
"Lenovo IdeaPad 5X 2-in-1 Copilot+ Extra-Long Battery Life 14"" WUXGA FHD+ OLED Touch Display 16GB Memory 512GB Storage Snapdragon X Plus 8-core Processor Windows 11 Home, Pen Included, Luna Gray",,4.0 out of 5 stars,26 ratings,In Stock
"2025 AMD Laptop, 15.6inch Laptop Computer with AMD Ryzen 7 5700U(8C/16T, Up to 4.3GHz), 16GB RAM 512GB NVMe SSD Windows 11 Laptop, Radeon RX Vega 8 Graphics,WiFi 6",,4.6 out of 5 stars,24 ratings,In Stock
"ASUS Vivobook 16 Laptop, Copilot+ PC, 16” WUXGA 60Hz Display, AMD Ryzen AI 7 350 with XDNA NPU, AMD Radeon Graphics, 16GB RAM, 1TB SSD, Quiet Blue, M1607KA-DS76",,4.5 out of 5 stars,129 ratings,In Stock
"15.6 Inch Laptop-Computer with MS Office, 12th Gen Intel Quad-Core N5095, 16GB RAM 512GB SSD (Expandable to 2TB), Win 11 Laptop, Backlit, Fingerprint, Type-C, HDMI, USB3.2, BT5.0, WiFi 5G",,4.5 out of 5 stars,15 ratings,In Stock
"15.6 Inch Laptop with Office 365, 4GB RAM, 128GB Storage Expandable 1TB, 5205U Processor, HD Display, Windows 11 Laptops Computer, Wi-Fi 5, BT4.2, Numpad, Type-C, for Business and Students.",,4.5 out of 5 stars,57 ratings,Only 4 left in stock - order soon.
"Lenovo IdeaPad 5X 2-in-1 Copilot+ Extra-Long Battery Life 14"" WUXGA FHD+ OLED Touch Display 16GB Memory 512GB Storage Snapdragon X Plus 8-core Processor Windows 11 Home, Pen Included, Luna Gray",,4.0 out of 5 stars,26 ratings,In Stock
"HP Chromebook 14 Laptop, Intel Celeron N4120, 4 GB RAM, 64 GB eMMC, 14"" HD Display, Chrome OS, Thin Design, 4K Graphics, Long Battery Life, Ash Gray Keyboard (14a-na0226nr, 2022, Mineral Silver)",,4.3 out of 5 stars,"2,185 ratings",In Stock
"HP 17 Laptop, 17.3"" HD+ Touchscreen Display, 12th Gen Intel Core i7-1255U, 64GB RAM, 2TB SSD, Webcam, HDMI, SuperSpeed USB Ports, Wi-Fi 6, Windows 11 Home, Silver",,4.3 out of 5 stars,824 ratings,Not Available
"HP Pavilion 15.6"" HD Touchscreen Anti-Glare Laptop, 16GB RAM, 1TB SSD Storage, Intel Core Processor up to 4.1GHz, Up to 11 Hours Long Battery Life, Type-C, HDMI, Windows 11 Home, Silver",,4.2 out of 5 stars,"1,335 ratings",Only 3 left in stock - order soon.
"Lenovo IdeaPad 1 Student Laptop, 15.6"" FHD Display, Intel Dual Core Processor, 12GB RAM, 512GB SSD + 128GB eMMC, 1 Year Office 365, Wi-Fi 6, Webcam, Bluetooth, SD Card Reader, Windows 11 Home, Grey",,4.3 out of 5 stars,803 ratings,In Stock
"2025 AMD Laptop, 15.6inch Laptop Computer with AMD Ryzen 7 5700U(8C/16T, Up to 4.3GHz), 16GB RAM 512GB NVMe SSD Windows 11 Laptop, Radeon RX Vega 8 Graphics,WiFi 6",,4.3 out of 5 stars,24 ratings,In Stock
"Dell Inspiron Touchscreen Laptop, 15.6"" Business & Student Laptop Computer, Windows 11 Pro Laptop 32GB RAM 1TB SSD, Intel i5-1155G7 Processor, Full HD IPS Display, Numeric Keypad, HDMI, Carbon Black",,4.2 out of 5 stars,651 ratings,In Stock
"Acer Aspire 3 A315-24P-R7VH Slim Laptop | 15.6"" Full HD | AMD Ryzen 3 7320U Quad-Core | AMD Radeon Graphics | 8GB LPDDR5 | 128GB NVMe SSD | Wi-Fi 6 | Windows 11 Home",,4.2 out of 5 stars,"4,163 ratings",In Stock
"HP 15.6 inch Laptop, HD Touchscreen Display, AMD Ryzen 3 7320U, 8 GB RAM, 256 GB SSD, AMD Radeon Graphics, Windows 11 Home, Natural Silver, 15-fc0399nr",,4.4 out of 5 stars,72 ratings,Only 1 left in stock - order soon.
"HP 15.6"" Business Laptop, Free Microsoft Office 2024 Lifetime License, Copilot AI Chat, HD Touchscreen Display, Intel 6-Core i3-1215U 4.4 GHz, 16GB RAM, 1TB SSD, Long Battery Life, Windows 11 Pro",,4.2 out of 5 stars,542 ratings,Only 6 left in stock - order soon.
"ASUS Vivobook 16 Laptop, Copilot+ PC, 16” WUXGA 60Hz Display, AMD Ryzen AI 7 350 with XDNA NPU, AMD Radeon Graphics, 16GB RAM, 1TB SSD, Quiet Blue, M1607KA-DS76",,4.5 out of 5 stars,129 ratings,In Stock
"HP Stream 14"" HD BrightView Laptop, Intel Celeron N4120, 16GB RAM, 416GB Storage (128GB eMMC + 288GB Docking Station Set), Intel UHD Graphics, 720p Camera, Wi-Fi, 1 Year Office 365, Win 11 S, Gold",,4.5 out of 5 stars,606 ratings,In Stock
"Coolby Laptop Computer, 14.1 inch Windows 11 Laptop with HD Display, 8GB RAM/128GB SSD, Intel N5095 Quad Core Notebook PC, Support 2.4G/5G WiFi, BT",,4.3 out of 5 stars,179 ratings,
"Lenovo IdeaPad 3i Chromebook, 15.6” FHD Display, Intel Celeron N4500, 8GB RAM, 64GB eMMC, 1920x1080 px, 720p Camera, Chrome OS, Abyss Blue",,4.3 out of 5 stars,964 ratings,Only 2 left in stock - order soon.
"Dell Inspiron 3520 Laptop - 15.6-inch FHD (1920 x 1080) 120Hz Display, Intel Core i5-1235U Processor, 8GB DDR4 RAM, 512GB SSD, WiFi 5, Windows 11 S Mode - Carbon Black",,4.3 out of 5 stars,292 ratings,Only 5 left in stock - order soon.
"ACEMAGIC 17.3"" Laptop with Quad Core-12th Alder Lake N97 Processor, FHD Display, 16GB RAM 512GB SSD Laptop, Windows 11 Laptops Computer, Webcam, Light&Thin,HDMI, Type-C, USB3.2",,4.7 out of 5 stars,47 ratings,In Stock
"SGIN 17.3 Inch Laptop Computer, Win 11 Laptops with Celeron I3 Processor, 4GB DDR3 128GB SSD, 60800mWh Battery, FHD IPS Display, HDMI, Type-C, Numpad, 5G WiFi, BT4.2, for Business and Students",,4.3 out of 5 stars,25 ratings,Only 6 left in stock - order soon.
"ASUS Vivobook S 14 OLED Slim Laptop, AMD Ryzen AI 9 365(10 Cores), 24GB, 1TB SSD, Customizable RGB Keyboard, Cool Silver, M5406WA-AH94",,4.6 out of 5 stars,248 ratings,In Stock
"ASUS Vivobook 16 Laptop, Copilot+ PC, 16” WUXGA 60Hz Display, AMD Ryzen AI 7 350 with XDNA NPU, AMD Radeon Graphics, 16GB RAM, 1TB SSD, Quiet Blue, M1607KA-DS76",,4.5 out of 5 stars,129 ratings,In Stock
"Lenovo IdeaPad 5X 2-in-1 Copilot+ Extra-Long Battery Life 14"" WUXGA FHD+ OLED Touch Display 16GB Memory 512GB Storage Snapdragon X Plus 8-core Processor Windows 11 Home, Pen Included, Luna Gray",,4.3 out of 5 stars,26 ratings,In Stock
